{
  "artifact_kind": "pooleos_native_microcode_golden_vectors",
  "contract_id": "PMCU1",
  "schema_version": "1.0",
  "synthetic_test_payloads_only": true,
  "vectors": [
    {
      "bundle_bytes": 1408,
      "bundle_hex": "504D435531000000010000000002000080000000FFFF0300010001000100010002000000200000008005000000000000000200000000000000030000000000008002000000000000400FB400FFFFFFFF41757468656E746963414D4400000000000000002040A4F12040A4F14040A4F10100010001000100010001000100010050B39C540C4F60C3BD639F142A31B1D720610AF2374D123EC825FA4E1CB107CCE917853364BE8168C8B5E289A5F5E5B9FA62306B8500C39CF59E7DAB62EAB103A215C40DE68E4211A3A7973F1CC1AD781FA2B31FDE8BF8D8C73F6FDAED654237417EA5195E49453EB241AAC52D8AD7478137137BB77C4DBE3D8BDCE0E57F3F1F44808DEA3DCACF71A224F5BFD674DFD94954A8407DEBCFA74D9127C3F1C4EC41F5F8E04B2DC45424FB2E1E27F9030697A29553E95AB3E16A2398C2F4655BE85B1881F3BE556EDA26C129D456F6C0C4C9EDC0C175A11511F26777A17BFDD84B810000000000000000000000000000000000000000000000000000000000000000000000000000000000000000000000000000000000000000000000000000000000000000000000000000000000000000000000000000000000000000000000000000000000000000000000000000000000000000000000000000000000000000000000000000000000000000000000000000000000000000000000000000000001000000FD010000400FB400FFFFFFFF00000000000000002040A4F1000000002040A4F1000000000003000000000000000100000000000010000000000000000B648C4DC1A018ADEC7FACD625EC698750F5B60CF528CC381209BA1C3AC2A9E8095C65FE38FFCB373725CEAA9FE59C16CB7BB6FC4EDEE11A3BCB4ADF7743795E02000000FE010000400FB400FFFFFFFF00000000000000004040A4F1000000002040A4F1000000000004000000000000800100000000000010000000000000000FBD3E755D66441891FB1E4F268E9EAA369203F4900683ACF9688C79C99DA36BF75E1B4A613CB42C03C7B9ABC0ACA239636A0C00BDE76ACE6C9135A5FF13F1F0504F4F4C454F5320504D4355312053594E5448455449432054455354205041594C4F4144202D204E45564552204150504C59006B6E6F776E2D676F6F64001FB950BE0AC3EF931655A3E789AD09B9C8CD6069209DD2A01F0489A979EFB2D314974790C874511BF964E6AD05D4ACF63F066EBA14B594FFA7C0FF3EF5DE4670E4F7C2D36A7268DAD474AEB708AA127CF399E1C50D30980A036A8B8CF83C4F70BBE88B331FD77C57E269C0D4C5F7CC55144458769853B82E43C9AAAA0D1EDCCF74DA3B86B688B56EC06E893758D46DE815E3F0334575587C7D3ABBB6B9631705307955CAA83C616F427D797EB58B5C0DAF1F26EDDCAA469E3CAF0A4B6C6C61800194504F4F4C454F5320504D4355312053594E5448455449432054455354205041594C4F4144202D204E45564552204150504C590070726566657272656400F9DF5E342E8A0AC357B2F58E969FB8DF7570D83321B711D3643BFB1D7EAEBB9FA5333DA6FE85E846C68ABDCF61B1457B288902E41B70B1C24CF116557FEA28B5C1F4A65632E6B074330526233D35508E6199D3619B2A33F00031AEF4EA571DB8F049584A922B69B2F47063CADE6AE35B514F419CB3E9069669C5D08472FCAA010FFDD1EC927EE8162A14BDC2BA643725E2964022FD0698FF4FA5BF0DFB81AF392890E879FD3CEDC3CA76885DCACCF53CC2CC3A7083105C531270D399549AD89E299E463C29D799415B409B8C96F6EE90F54289A86A712FE258EE40A2B93BEB63CA551F2E2C6543277A30DC4AE96F9771D270899DC8294ABC93F5DD4927233AD4919337E315CFCA0700A38CE613F119991CF9629A6A7B41CB28AEF56053E6CBE7B6EE7CB18C29E62A0EF3873AA469BE0480114FA6727CCDBBFDF8A7DBB42E89111AF76B",
      "bundle_sha256": "D1EF85112EC9834E972C7CC49892B3CE81FE3464F1D143A94DBE37D59843ACE6",
      "id": "PMCU1-CANONICAL",
      "known_good_revision": 4054073376,
      "patch_count": 2,
      "preferred_revision": 4054073408,
      "security_revision_floor": 4054073376,
      "selection_samples": [
        {
          "authenticated_rollback_floor": 4054073376,
          "boot_mode": 1,
          "cpuid_signature": 11800384,
          "current_revision": 4054073360,
          "expected": {
            "current_revision": 4054073360,
            "decision": "apply",
            "patch_id": 2,
            "required_floor": 4054073376,
            "revision": 4054073408
          },
          "platform_id": 0,
          "revoked_revisions": []
        },
        {
          "authenticated_rollback_floor": 4054073376,
          "boot_mode": 1,
          "cpuid_signature": 11800384,
          "current_revision": 4054073408,
          "expected": {
            "current_revision": 4054073408,
            "decision": "skip_current",
            "patch_id": 2,
            "required_floor": 4054073376,
            "revision": 4054073408
          },
          "platform_id": 0,
          "revoked_revisions": []
        },
        {
          "authenticated_rollback_floor": 4054073376,
          "boot_mode": 2,
          "cpuid_signature": 11800384,
          "current_revision": 4054073408,
          "expected": {
            "current_revision": 4054073408,
            "decision": "reset_for_known_good",
            "patch_id": 1,
            "required_floor": 4054073376,
            "revision": 4054073376
          },
          "platform_id": 0,
          "revoked_revisions": [
            4054073408
          ]
        }
      ]
    },
    {
      "bundle_bytes": 768,
      "bundle_hex": "504D435531000000010000000002000080000000FFFF0300010001000100010001000000200000000003000000000000000200000000000080020000000000008000000000000000400FB400FFFFFFFF41757468656E746963414D4400000000000000000140A4F10140A4F10140A4F10100010001000100010001000100010050B39C540C4F60C3BD639F142A31B1D720610AF2374D123EC825FA4E1CB107CCE917853364BE8168C8B5E289A5F5E5B9FA62306B8500C39CF59E7DAB62EAB103A215C40DE68E4211A3A7973F1CC1AD781FA2B31FDE8BF8D8C73F6FDAED654237417EA5195E49453EB241AAC52D8AD7478137137BB77C4DBE3D8BDCE0E57F3F1F44808DEA3DCACF71A224F5BFD674DFD94954A8407DEBCFA74D9127C3F1C4EC41056CE2F2238D9666B8C58A130E68F9235EEC21975BE8112B3CC908F4133CF1CAA6BA33FE0BD66B4855AB50695A20E349D8110A4D04AEDFD9AF56726F47068A4F0000000000000000000000000000000000000000000000000000000000000000000000000000000000000000000000000000000000000000000000000000000000000000000000000000000000000000000000000000000000000000000000000000000000000000000000000000000000000000000000000000000000000000000000000000000000000000000000000000000000000000000000000000000001000000FF010000400FB400FFFFFFFF00000000000000000140A4F1000000000140A4F1000000008002000000000000800000000000000010000000000000006C03EDBC21896369F831DB09F16677E9703A8ED61BE293C65C69B095FAEBD7A170014A046F1D49DCC766026375C487E82F2FA824F8F3BFD265D6E85AB6F7E112504F4F4C454F5320504D4355312053594E5448455449432054455354205041594C4F4144202D204E45564552204150504C59006D696E696D616C00770B98FC7873D33C467C1583B4A1560B36941C23BE8F59CC7994DF6F979E7FFD2B82E2027BE3DA6864395522F272A1AEF9BB29B506C89074ECFB3E37B810B6A14E132E08CF",
      "bundle_sha256": "AA62F53A0368A435A18B072538257EA2659638EE4951ABDD9C6108A7BB3FEC03",
      "id": "PMCU1-MINIMAL",
      "known_good_revision": 4054073345,
      "patch_count": 1,
      "preferred_revision": 4054073345,
      "security_revision_floor": 4054073345,
      "selection_samples": [
        {
          "authenticated_rollback_floor": 4054073345,
          "boot_mode": 1,
          "cpuid_signature": 11800384,
          "current_revision": 4054073344,
          "expected": {
            "current_revision": 4054073344,
            "decision": "apply",
            "patch_id": 1,
            "required_floor": 4054073345,
            "revision": 4054073345
          },
          "platform_id": 0,
          "revoked_revisions": []
        }
      ]
    },
    {
      "bundle_bytes": 5120,